id,headline,question,claim,paragraph,covered
29,Nike Reports 14% Revenue Growth to $12.4 Billion Despite Declining Net Income and Challenges in China.,What challenges did Nike face in the Greater China region and how did it affect the company's revenue?,"Nike faced challenges in the Greater China region and saw a 1 per cent increase on a currency-neutral basis, despite experiencing a challenging December due to the shift in COVID-19 policies.","""We are confident looking ahead with strong traffic and retail sales growth and reduced inventory buys for the spring and summer seasons, we are increasingly confident that we will exit the year with healthy inventories across the marketplace,"" said Friend. ""In fact, given our brand momentum, we now intend to move through even more units by year-end than we had previously considered.""In the third quarter, revenues for Nike, Inc. increased 14 percent to $12.4 billion, easily topping Wall Street's",yes
30,"Finland's NATO membership bid moves forward as Turkey prepares to ratify, leaving Sweden's application in limbo.",What are the political and economic implications of the current situation for Sweden and Turkey?,"Even while Sweden's ratification is pending, its ""defense and political integration into the Alliance is ongoing,"" Anna tells us, ""and interestingly enough, Turkey is not blocking it.""","Chris says the delay Sweden is facing in joining NATO ""means very little for practical purposes. Should a crisis erupt in the Baltic Sea region, Sweden could operate seamlessly alongside NATO allies .""says the delay Sweden is facing in joining NATO ""means very little for practical purposes. ."" Even while Sweden's ratification is pending, its ""defense and political integration into the Alliance is ongoing,"" Anna tells us, ""and interestingly enough, Turkey is not blocking it."" Plus, allies such as",no
31,"Somalia Faces Severe Drought Crisis with 43,000 Estimated Deaths in 2022, Warns WHO and UNICEF.",How do humanitarian workers alleviate the suffering by the drought on the affected areas?,The Somali minister of health Ali Hadji Adam Abubakar has urged all partners and donors to continue to support the health sector in building a resilient health system that works for everyone and not for the few.,"Somalia was hit by a famine in 2011 which killed 260,000 people, more than half of them children under six, partly because the international community did not act fast enough, according to the UN.Story continuesIn 2017, more than six million people in the country, more than half of them children, needed aid because of a prolonged drought across East Africa.But early humanitarian action averted famine that year.The conflict-wracked nation is considered one of the most vulnerable to climate change",no
32,Protests in Kenya led by opposition leader Raila Odinga demand President William Ruto's resignation amid rising living costs and allegations of electoral fraud.,What are the economic conditions that led to the protests?,"""Kenyans are suffering from spiraling prices for fuel, electricity, and staple foods, as well as a slump in the value of the shilling against the US dollar and a record drought that has left millions hungry.""","Kenyans are suffering from surging prices for basic necessities, as well as a sharp drop in the local shilling against the US dollar and a record drought that has left millions hungry.We need your consent to load this rte-player contentWe use rte-player to manage extra content that can set cookies on your device and collect data about your activity. Please review their details and accept them to load the content.Manage Preferences""We came here peacefully but they tear gassed us,"" said Charles Od",yes
33,House Republicans Demand Testimony from Manhattan DA Alvin Bragg Amid Looming Indictment of Former President Trump for Hush Money Payment to Stormy Daniels.,How have the New York prosecutions against Trump affected his base,Republican activists and voters in Montgomery County were carefully weighing the stakes Monday ahead of a potential indictment and arrest of former President Donald Trump.,"This is a carousel. Use Next and Previous buttons to navigateRepublican activists and voters in Montgomery County were carefully weighing the stakes Monday ahead of a potential indictment and arrest of former President Donald Trump on allegations he paid hush-money to a former porn star to keep their romantic affair secret.In a social media post Saturday, Trump said that he expects to be arrested as early as Tuesday as the Manhattan District Attorney's Office eyes charges in a case examining the",yes
34,"Massive fish kill in Australia's Darling River near Menindee attributed to heatwave and low oxygen levels, affecting millions of species including Bony Herring.",How is the media coverage of the event affecting public perceptions of climate change and environmental issues?,"The media coverage is explaining that while floodwaters increased the bacteria in the river which broke down dead wood, causing oxygen to be sucked out of the water, the long-term cause of the river's decline is not just climate change but irrigation, and over-extraction of water.","Short term pressure, long term painI was a member of the expert panel investigating the 2018-2019 Menindee fish kills. Everyone agreed the fish ran out of oxygen. It was a very dry period, and a cool front arriving after a heat wave mixed deep low-oxygen river water with the thin top layer which had oxygen.But our panel also examined the long-term changes to the river. We found the long-term cause for the river's decline was simple: too much water was being diverted upstream.It wasn't just clima",no
35,Miami Beach imposes curfew after two fatal shootings during chaotic spring break festivities.,What is the current state of crime in Miami Beach?,"Miami Beach finds itself struggling with spring break violence, including two fatal shootings and unruly crowds, despite a massive police presence and activities designed to give people alternatives to drinking alcohol and roaming the streets.","For the third year in a row, Miami Beach finds itself struggling with spring break violence, including two fatal shootings and unruly crowds, despite a massive police presence and activities designed to give people alternatives to drinking alcohol and roaming the streets.The city imposed an overnight curfew that ended Monday morning but decided not to enact a second curfew next weekend, when the Ultra Music Festival will draw thousands of people to South Beach. It's the third weekend of spring b",yes
36,"U.S. State Department's 2022 Human Rights Report highlights significant abuses in India, Pakistan, Israel, and China under Secretary Antony Blinken.","What challenges and opportunities lie ahead for advancing human rights efforts worldwide, and how can the US respond to these developments?","One opportunity for advancing human rights efforts worldwide is to increase attention to reporting of threats and violence against human rights defenders, particularly those advocating for the environment and land as well as Indigenous peoples' rights.","Torture and Other Cruel, Inhuman, or Degrading Treatment or Punishment, and Other Related Abuses: Covers ""torture,"" defined in the Convention against Torture, Article 1, as ""any act by which severe pain or suffering, whether physical or mental, is intentionally inflicted on a person for such purposes as obtaining from him or a third person information or a confession, punishing him for an act he or a third person has committed or is suspected of having committed, or intimidating or coercing him ",no
37,"UK to supply Ukraine with depleted uranium ammunition, prompting warnings of escalation from Russia.",How will the UK's decision impact the ongoing conflict in Ukraine?,Putin's comments came after the British Defense Ministry said it would be providing Ukraine with ammunition for the Challenger 2 battle tanks that London pledged to Kyiv - which includes armor piercing rounds that contain depleted uranium.,"""It's worth making sure everyone understands that just because the word uranium is in the title of depleted uranium munitions, they are not nuclear munitions, they are purely conventional munitions.""Britain has used depleted uranium in its armour piercing shells for decades and does not consider those rounds as having a nuclear capability. Russia is known to also use ammunition containing depleted ammunition.It is a particular health risk around impact sites, where dust can get into people's lun",yes
38,"Uganda's Parliament passes an extreme anti-homosexuality bill proposing the death penalty, prompting international condemnation from the UN and the US.",What impact will the new law have on the LGBTQ community in Uganda?,The U.N. AIDS agency warns that the legislation 'threatens public health' because it would hurt efforts to fight HIV.,"Washington has ""grave concerns"" about the bill, White House press secretary Karine Jean-Pierre said Wednesday, adding that it would hamper tourism and economic investment in Uganda.U.S. National Security Council spokesman John Kirby said if the law were enacted Washington would ""have to take a look"" at imposing economic sanctions on Uganda. He noted that this would be ""really unfortunate"" since most U.S. aid is in the form of health assistance, especially AIDS-related assistance.The U.N. AIDS ag",yes
39,Nike Reports 14% Revenue Growth to $12.4 Billion Despite Declining Net Income and Challenges in China.,"How did Nike's revenue and net income change in North America, Europe, the Middle East, Africa, the Asia Pacific, Latin America and Greater China?","As Nike looks to generate more sales in China while the region recovers from the COVID pandemic, last quarter's figures were not promising. In the fiscal third quarter, the company's sales fell 8% to $1.99 billion USD in the region.","Konik said that Jefferies' own data suggested that holiday-season interest in sneakers was still strong, despite inflation. And he said trends in China were getting better, as that nation's economy reopens.Foot Locker Inc. FL, +7.07% on Monday said that it had ""revitalized"" its relationship with Nike -- to focus on data-sharing and sneaker culture -- after Nike began focusing on selling products online and through its own retail stores. And after weaker sales of Nike products in the past, Foot L",no
40,"Israel's Knesset Repeals Disengagement Law, Allowing Settlers Back into Northern West Bank Amid U.S. and International Criticism.","What law did the Knesset repeal in the West Bank's North Samaria, and what impact does it have on the Israeli-Palestinian conflict?",The repeal of the law allows Jews to live in northern Samaria.,"Israeli Prime Minister Benjamin Netanyahu hailed on Wednesday the Knesset's partial repeal of the ""discriminatory and humiliating"" 2005 Disengagement Law that expelled Jews from their ""historical homeland.""The Israeli parliament on Tuesday voted to repeal articles of the law banning Israelis from entering and residing in parts of northern Samaria. The disengagement also led to the destruction and evacuation of 21 communities in the Gaza Strip.""The Knesset decision to repeal parts of the Disengag",no
41,"Researchers Find Human Microbes on Mount Everest, Raising Concerns About Environmental Impact and Future Space Exploration.","What was surprising about the results of the study, particularly in relation to bacteria and fungi?","The researchers were able to cultivate bacteria and fungi that had been transported to Everest by wind or humans from other, less extreme environments.","So how does human DNA get left behind on a place like Everest?Of course, we humans shed microbes wherever we go. But the researchers said it was ""surprising"" that microbes that've evolved to thrive in the warm and wet environments of our bodies can also survive - in a dormant state - in the harsh conditions of the death zone on Everest. Schmidt said:There is a human signature frozen in the microbiome of Everest, even at that elevation.Taking samples from the South ColIn light of the extreme envi",yes
42,"U.S. State Department's 2022 Human Rights Report highlights significant abuses in India, Pakistan, Israel, and China under Secretary Antony Blinken.","What human rights abuses were detailed in the annual report, and which countries committed them?","The annual report detailed several human rights abuses in Pakistan, including ""unlawful or arbitrary killings, including extrajudicial killings by the government or its agents; forced disappearances by the government or its agents; torture and cases of cruel, inhuman, and degrading treatment or punishment by the government or its agents.""","The report also mentions that a lack of accountability for official misconduct persisted at all levels of government in India, contributing to widespread impunity. Among the significant human rights violations in India in 2022, as per the State Department, are unlawful and arbitrary killings, inhuman or degrading treatment or punishment by police and prison officials, and harsh and life-threatening prison conditions.It also flagged alleged arbitrary arrest and detention, unlawful interference wi",no
43,"NVIDIA unveils new AI GPUs H100 NVL and L4 for generative AI deployment, partnering with Google Cloud to enhance AI capabilities.",How might Nvidia's new offerings reshape the landscape of AI hardware?,"The new platforms will contain specialized software with an NVIDIA GPU optimized for specific generative AI inference workloads. They are optimized for some in-demand workloads, including AI video, image generation, large language model deployment, and recommender inference.","Seyhan Lee, a leading AI production studio, uses generative AI to develop immersive experiences and captivating creative content for the film, broadcast and entertainment industries.""The L40 GPU delivers an incredible boost in performance for our generative AI applications,"" said Pinar Demirdag, co-founder of Seyhan Lee. ""With the inferencing capability and memory size of the L40, we can deploy state-of-the-art models and deliver innovative services to our customers with incredible speed and acc",no
44,"Bob Metcalfe awarded 2022 Turing Award for inventing Ethernet, the foundational networking technology for the internet.",What impact did Bob Metcalfe's invention and entrepreneurship have on the computing industry?,"Bob Metcalfe's invention of Ethernet has had a significant impact on the computing industry, becoming the ""main conduit of wired network communications worldwide,"" with emerging technologies that have data rates of up to 1.6 Tbps.","Wired Ethernet began at Xerox PARC with data transfer speeds of 2.94 megabits per second. Now it's reached 800 gigabits per second -- about 272,000 times faster. Another doubling is in the works, to 1.6 terabits per second.Wired Ethernet ports have faded from laptops and never arrived on phones. But the technology was adapted to the Wi-Fi standards, bringing new convenience and ubiquity to the internet. (Metcalfe prefers Wi-Fi's original name, Wireless Ethernet.)Token Ring grudgeToday, it's near",yes
45,"Saudi Arabia and Iran agree to restore diplomatic ties in a China-brokered deal, signaling a shift in Middle Eastern geopolitics.",Will the U.S.-Saudi relationship reach a detente?,"The agreement brings potential for addressing conflicts diplomatically, rather than through conflict, and reduces the chance of regional war.","Even if the agreement, brokered by China after years of negotiations mediated by Iraq, holds, the competition for regional dominance between the two major oil exporters, who also are each seen as leaders, or at least prominent hubs, of different denominations of Islam, will still be there. Some territorial disputes will remain, as will regional conflicts in places like Yemen, Syria, and Lebanon where the two countries often back opposing forces.AdvertisementNonetheless, the agreement brings sign",yes
46,"Astronomers warn that increasing light pollution from satellite mega-constellations, especially by SpaceX, threatens astronomical observations and cultural connections to the night sky.",What international treaties and goals can be set to restrict levels of light pollution?,"""Astronomers are pushing back, calling for caps on night lighting from both below and above.""","PLAVCHAN: With the launch of the increasing proliferation of satellites in low Earth orbit, which reflect a lot of sunlight down to us, we can't escape it.HUANG: Astronomers are pushing back, calling for caps on night lighting from both below and above.Pien Huang, NPR News. Transcript provided by NPR, Copyright NPR.",yes
47,"Japanese Hayabusa2 mission discovers uracil and niacin in asteroid Ryugu samples, suggesting building blocks of life may have originated in space.",How does the discovery affect the understanding of the origin of life?,"The researchers want to know how common these molecules are in asteroids, and a comparative study of the composition of asteroids Ryugu and Bennu which both contain biologically important molecules will provide further data to build on current theories about the origins of life.","""It is no doubt that biologically important molecules such as amino acids and nucleobase(s) in asteroids/meteorites have been provided to the Earth,"" Oba said. ""In particular, we expect they might play a role for prebiotic evolution on the early Earth.""It's also possible that as space rocks smashed into other planets in our solar system, they might have been carrying some of the same building blocks of life.""I cannot say the presence of such ingredients directly leads to the emergence/presence o",yes
48,"Canada's inflation rate drops to 5.2% in February, as the Bank of Canada pauses interest rate hikes amidst high grocery prices.",What were the signs of stickiness in consumer prices in February 2022,Canadians paid 5.2 percent more for goods and services in February than a year earlier.,"Inflation for goods in Canada is cooling but prices for food remain high, Statistics Canada's latest report shows.The Consumer Price Index (CPI) for February was at 5.2 per cent year-over-year, a decrease from January's 5.9 per cent year-over-year increase.""This was the largest deceleration in the headline CPI since April 2020,"" the StatCan report reads.Energy reflected the cooling as prices fell 0.6 per cent year-over-year. Gasoline prices are leading the drop, StatCan says, with a 4.7 per cent",no
49,"Ford, GM, BMW, and Volkswagen Join Tesla in Aggressive Price Cuts to Boost EV Sales Amidst China's Market Slump.",How will China's EV market respond to increased competition?,"""As the supply/demand environment continues to change, we would prepare for potentially lower margins (at gross and OP) than consensus currently forecasts for Tesla.""","Although a more affordable option is on the way, Tesla will work with what it has for now, and in order to make its already industry-leading vehicles reach even higher sales figures, it can just cut prices.But this comes with a consequence for investors, Adam Jonas, the Morgan Stanley analyst responsible for covering Tesla, said in the note:""As the supply/demand environment continues to change, we would prepare for potentially lower margins (at gross and OP) than consensus currently forecasts fo",yes
50,U.S. Commerce Department Implements Restrictions on Semiconductor Funding to Prevent Expansion in China Amid National Security Concerns.,How will the new restrictions change the dynamics of the semiconductor industry's economic landscape,"The new restrictions prohibit recipients of US government funding operating in China from spending more than US$100,000 to expand their chip facilities there, or boosting such facilities' production capacity by more than 5%, and they also are forbidden to expand any existing facility's production capacity by more than 10% unless at least 85% of its output is incorporated into final products that are consumed locally.","Through these measures, we can complete the domestic supply chain that the CHIPS and Science Act endeavors to secure. If we focus only on the front end and do not include support for back-end packaging activities, it leaves open a critical gap and enables our international competitors to beat us in developing these advanced technology industries.",yes
51,"ICC issues arrest warrant for Putin as Russia launches drone strikes on Ukraine, intensifying conflict.",How does the use of drones fit into the larger geopolitical tensions and power struggles between countries in the 21st century?,"The discovery that the drone contained various electronic parts developed by Taiwanese companies highlights the risk of dual-use products being supplied to Russia, which has increased due to Western sanctions.",". On 13 March 2023, Russian Duma deputies introduced a bill to change the age bracket for conscription to men aged 21-30 years, from the current 18-27. The law is likely to be passed and would come into force in January 2024. Russia has continued to run conscription call-up cycles twice a year since Soviet times . They are distinct from the exceptional partial mobilisation of veterans carried out since September 2022. Russia continues to officially bar conscripts from operations in Ukraine, thou",yes
52,International Criminal Court Issues Arrest Warrant for Vladimir Putin Over Alleged War Crimes Involving Ukrainian Children.,What is Russia's justification for abducting Ukrainian children and does it hold water?,"Russia denies committing any atrocities since it invaded Ukraine, rejects the ICC's move as null and void, and says the court's decisions have no meaning for their country including from a legal point of view.","The ICC said it sees reasonable grounds to believe that Putin bears individual responsibility for the crimes either by committing them directly, jointly with others and/or through others.It also said he failed to exercise proper control over civilian and military subordinates who committed the acts or allowed for their commission and who were under his effective authority and control.The arrest warrant obliges member states to arrest Putin or Lvova-Belova if they were to travel to their country.",yes
53,"Twenty Years After the Iraq War, Critics Reassess George W. Bush's Justifications and the Ongoing Impact of the Invasion.",What were the effects of the Iraq War on US foreign policy and relations with other countries?,"The Iraq War damaged the US economy and led to costly foreign policy decisions, including the Global War on Terrorism, which cost an estimated $1.6 trillion and accounted for half of the total casualties since 9/11.","Twenty years ago, a U.S.-led coalition invaded Iraq with the stated aims of disarming Saddam Hussein's weapons of mass destruction, stopping his support for Al-Qaeda, and liberating the Iraqi people. The war turned out to be an epochal failure, as this magazine warned, Cassandra-like, at the time. So naturally, the warmaker-in-chief, George W. Bush, now basks in the media glow of a ""responsible"" wise man, while the antiwar Donald Trump is facing a criminal indictment.Let us briefly recount the c",yes
54,Poland's Prime Minister Mateusz Morawiecki warns that Ukraine's defeat against Russia would signify a broader defeat for the West and calls for a Europe rooted in nation-states.,How does the Prime Minister's warning relate to the challenges facing Europe and what implications could this have for the future of the continent?,"Morawiecki argued that Europe has to prove its strength that comes from the diversity of its nations and nothing can safeguard the nations, their culture, their social, economic, political and military security better than nation states.","(c) Ukrainska PravdaPoland's Ambassador to France Jan Emeryk Rosciszewski said in an interview that a situation could arise in which Poland would have to enter the war. The embassy urged audiences to refrain from sensationalising his words.Source: Rosciszewski in an interview with LCI, a French TV channel; Rzeczpospolita, a Polish media outlet, citing Poland's Embassy in FranceQuote from Rosciszewski: ""It is not NATO, Poland or Slovakia that are mounting ever more pressure, but Russia, which has",no
55,Meta Platforms (META) stock sees mixed analyst ratings and a recent upgrade to Overweight amid ongoing challenges and a focus on efficiency.,"What do analysts think about Meta Platforms' future prospects, and what are their predictions?","Meta Platforms Inc (NASDAQ: META) has been subject to 47 price forecasts by analysts over the next 12 months, with a median target of 225.00.","Meta Platforms (NASDAQ:META - Get Rating) last released its quarterly earnings results on Wednesday, February 1st. The social networking company reported $3.00 earnings per share for the quarter, topping the consensus estimate of $2.12 by $0.88. Meta Platforms had a net margin of 19.90% and a return on equity of 21.23%. The firm had revenue of $32.17 billion during the quarter, compared to the consensus estimate of $31.69 billion. During the same quarter in the prior year, the firm earned $3.67 ",no
