id,headline,question,claim,paragraph,covered
56,"Tesla's Model Y battery design faces criticism for ""zero repairability,"" leading to higher insurance premiums and the scrapping of low-mileage EVs.",Will automakers make their batteries more repairable and allow third parties access to their EV battery data?,"Many carmakers have argued their battery packs are repairable but many car repair shops, insurers, and leasing companies are not aware of the data, spurring some legal fights.","To make matters worse, most automakers don't want to allow insurers or repair companies access to the diagnostics software, which dooms many batteries that could have been repaired.Indeed, typical battery packs are constructed of a specific number of cells placed next to each other inside of a metal enclosure.With the proper equipment, technicians can gauge the status of each individual cell and replace only those that have been affected in case of an accident, which dramatically reduces repair ",yes
57,"NASA's James Webb Space Telescope detects dynamic silicate clouds and multiple molecules on the exoplanet VHS 1256 b, 40 light-years away.",How did the discovery of VHS 1256 b come about and what challenges did the research team face during their study?,The fact that VHS 1256 b is located about four times farther from its stars than Pluto is from our Sun made it easier for the telescope to detect the planet's atmosphere since the planet's light was not mixed with light from the stars.,"The telescope also detected water, methane and carbon monoxide as well as of evidence of carbon dioxide on the planetIllustration: NASA, ESA, CSA, Joseph Olmsted (STScI) Clouds as seen by Webb telescopeNASA's James Webb space telescope uncovered ""swirling clouds"" on a distant planet, indicating a significant scientific finding.According to NASA, the cloud features are ""so dramatic that it is the most variable planetary-mass object known to date.""Researchers explain that the distant planet's ""atm",no
58,"Saudi Arabia and Iran agree to restore diplomatic ties in a China-brokered deal, signaling a shift in Middle Eastern geopolitics.",How might the deal brokered by China and the United States impact U.S.-China competition in the Middle East?,"Taleblu argued that ultimately this agreement is a ""sign of the times"" and shows that U.S. partners in the Middle East are increasingly stepping back from Washington's influence.","Recognising the nature of the current global order is important because it has consequences for how countries behave and how international politics works. A common error in Indian foreign policy rhetoric, but not exclusively an Indian mistake, is that the current order is multipolar. Sometimes, this belief morphs into an ""aspiration"", as Indian foreign minister S. Jaishankar put it some time back.This is doubly dangerous because letting desires drive foreign policy is both a refusal to look at r",yes
59,North Koreans resent Kim Jong Un's daughter Kim Ju Ae for her lavish lifestyle amid the country's severe food shortages.,Could Kim Ju Ae be used as a bargaining chip by the North Korean regime in international negotiations?,The article states that Kim Ju Ae has appeared in suspected propaganda videos during North Korea's ongoing food shortage.,"Kim Jong-un's young daughter is resented across North Korea for appearing ""plump like the moon"" while the nation's ""common people"" starve, RadarOnline.com has learned.Jong-un's daughter, nine-year-old Kim Ju Ae, has recently made a series of rare appearances in suspected propaganda videos broadcasted by North Korea amid the nation's ongoing food shortage.",yes
60,"Amazon and Meta announce a combined 48,000 layoffs as both companies shift focus to cost-cutting in response to economic pressures.","Which other tech company has announced layoffs recently, and how do Amazon's layoffs compare in size and scope to theirs?",Amazon's layoffs compare in size and scope to Facebook and Google layoffs in recent times.,"The news also arrives just a week after another tech giant, Facebook parent Meta, announced that an additional 10,000 workers are to be laid off at its company.Meta's own announcement marked its second round of layoffs in four months, after cutting around 13% of its global workforce in November.The previous reduction in staff totaled 11,000 layoffs, which means that across the two rounds of layoffs, Meta is letting some 22,000 employees go.Amazon's latest announcement brings its own layoff tally",no
61,"Mass protests erupt in France against President Emmanuel Macron's controversial pension reform raising the retirement age from 62 to 64, bypassing parliamentary vote.",What are the possible long-term effects of the pension reform bill on the French economy and society?,"The possible long-term effects of the pension reform bill on the French economy are that ""oil shipments in the country were partially disrupted amid strikes at several refineries in western and southern France"" and ""French government spokesperson Olivier Veran warned that more orders may follow in the coming days for other sites.""","""We are coming to the end of the democratic process of this essential reform for our country,"" Prime Minister Elisabeth Borne said. ""It is with humility and seriousness that I took my responsibility and that of my government.""Opponents say this shows Macron's decision to bypass a parliamentary vote on the pension bill -- which triggered the no- confidence motions - has already undermined his reformist agenda and weakened his leadership.All eyes now turn to the president who is due to speak to th",yes
62,"Silicon Valley Bank collapses due to ignored Federal Reserve warnings on risk management, triggering fears of a banking crisis across the tech sector.",Could SVB's fate have been avoided with better management and oversight?,"Yes, ""California's top financial regulator will scrutinize the oversight and regulation it applied to Silicon Valley Bank, whose sudden failure on March 10 ignited a wider crisis.""","Customers lined up outside Silicon Valley Bank headquarters in Santa Clara, California, on March 13, three days after the bank was shut down by California regulators and taken over by the Federal Deposit Insurance Corp. David Paul Morris/BloombergCalifornia's top financial regulator will scrutinize the oversight and regulation it applied to Silicon Valley Bank, whose sudden failure on March 10 ignited a wider crisis.The Department of Financial Protection and Innovation said Monday that it is con",yes
63,"Damning report by Baroness Louise Casey reveals the Metropolitan Police's ""institutional racism, misogyny, and homophobia,"" calling for urgent reforms or potential disbandment.",What did the independent review into the Metropolitan Police Service conclude?,"The Met was described as a ""demoralising place to work"" which ""beats you down"".","Cold comfort from Rishi: In his BBC Breakfast interview, Sunak doesn't exactly come riding to his predecessor-but-one's rescue. Asked about his decision to grant a free vote on any penalty recommended by the committee, the PM says: ""That's generally the rule of thumb with these things. These are matters for individuals rather than for government."" Asked if he agreed with friends of Johnson that the committee's investigation was a ""witch hunt,"" he said: ""That's ultimately something for Boris John",no
64,"Cyclone Freddy devastates Malawi and Mozambique, killing hundreds and worsening cholera outbreaks amid humanitarian crisis.",How can governments and international organizations work together to provide long-term support and assistance to the affected communities?,"In Zambia, the Catholic Church in the Copperbelt Province is already mobilizing financial and material resources to support the victims.","""Expressing our sincere thanks in advance for all that you can do for the victims of cyclone Freddy, we implore God's abundant blessings for all,"" the clerics said.In Malawi, the Bishops urged ""all Catholics, and people of good will, to stand with the victims of this devastating cyclone and immediately begin to donate whatever they can, in money and in kind, to help the victims who have been affected and are suffering from the effects of the cyclone.""The clerics in their March 14 statement said ",yes
65,"U.S. State Department's 2022 Human Rights Report highlights significant abuses in India, Pakistan, Israel, and China under Secretary Antony Blinken.","What human rights abuses were detailed in the annual report, and which countries committed them?","The annual report detailed Israel's respect for civil liberties, restrictions on Palestinians, investigations of security forces for abuses, arbitrary or unlawful killings committed by the government or its agents, patients with mental disabilities' greater risk of being subjected to violence when interacting with police, utilizing isolation to punish or silence politically prominent Palestinian detainees, and Israel's posture toward human rights NGOs.","However, it goes on to say that NGOs and Palestinian journalists ""reported Israeli authorities restricted press coverage and placed limits on certain forms of expression, particularly for Palestinians,"" which include ""restricting Palestinian journalists' movement as well as using violence, arrests, closure of media outlets, and intimidation, according to media reports and the Palestinian Center for Development and Media Freedoms.""'The report flags Israel's posture toward human rights NGOs, who c",yes
66,"U.S. State Department's 2022 Human Rights Report highlights significant abuses in India, Pakistan, Israel, and China under Secretary Antony Blinken.","What human rights abuses were detailed in the annual report, and which countries committed them?","The report covers abuses committed by multiple countries and territories worldwide, but does not describe or assess the human rights implications of actions taken by the U.S. government or its representatives. However, specific abuses reported in the 2022 report include increased attention to threats and violence against human rights defenders, particularly those advocating for the environment and Indigenous peoples' rights. Additionally, there is an expanded subsection on politically motivated reprisal against individuals located outside the country, new and expanded information on abuses against LGBTQ+ individuals and greater information on the use of technology to arbitrarily or unlawfully surveil individuals.","In 2022 there is increased attention to reporting of threats and violence against human rights defenders, particularly those exercising their civil and political rights to advocate for the environment and land as well as Indigenous peoples' rights. Additionally, in section 1.e. of this year's reports, as has been the case since the 2019 reports, there is an expanded subsection on politically motivated reprisal against individuals located outside the country (otherwise known as ""transnational rep",yes
67,"Astronomers warn that increasing light pollution from satellite mega-constellations, especially by SpaceX, threatens astronomical observations and cultural connections to the night sky.",What international treaties and goals can be set to restrict levels of light pollution?,"""Astronomers are pushing back, calling for caps on night lighting from both below and above.""","PLAVCHAN: With the launch of the increasing proliferation of satellites in low Earth orbit, which reflect a lot of sunlight down to us, we can't escape it.HUANG: Astronomers are pushing back, calling for caps on night lighting from both below and above.Pien Huang, NPR News. Transcript provided by NPR, Copyright NPR.",yes
68,"Several Western countries, including the US, UK, and New Zealand, have imposed or are considering bans on TikTok due to national security concerns involving its Chinese parent company, ByteDance.",How does the banning of TikTok relate to broader cybersecurity concerns?,Divestment by ByteDance may not solve the American national security concerns over TikTok and may set a precedent for the US government to safeguard personal information of US citizens in the future.,"A ban on TikTok could open the door for other companies, such as Meta's Instagram, to fill the video-sharing void. In October, Twitter CEO Elon Musk said he was thinking about bringing back Vine, the short-form video app that was discontinued in 2019.Will divestment make TikTok more secure?TikTok has been in negotiations with CFIUS about national security requirements for more than two years. Chew, TikTok's CEO, told the Wall Street Journal on Thursday that a sale of the company won't solve the ",no
69,U.S. Commerce Department Implements Restrictions on Semiconductor Funding to Prevent Expansion in China Amid National Security Concerns.,What are the advantages and disadvantages of implementing restrictions on semiconductor companies operating in China,"""Advantages of implementing restrictions on semiconductor companies operating in China include ensuring that ""malign actors do not have access to the cutting-edge technology that can be used against America and our allies,"" increasing national security, and strengthening global supply chains.""","The U.S. also classified a list of semiconductors as critical to national security, making them subject to stricter controls than other legacy chips. Those include compound semiconductors -- an area of focus for the Chinese government in past years -- chips designed for quantum information systems, specialized military capabilities and in radiation-intensive environments.Want more news? Listen to today's daily briefing above or go here for more infoFederal grant recipients will also be prohibite",no
70,Peter Obi of the Labour Party challenges Bola Tinubu's victory in Nigeria's presidential election through a court petition alleging electoral irregularities.,"What possible outcomes could arise from Peter Obi's challenge to the presidential election outcome, especially with Bayo Onanuga's continued inciting comments?","Peter Obi's move to challenge the outcome of the 2023 presidential election, according to Bayo Onanuga could be viewed in the same way that the 1993 election of MKO Abiola was invalidated by IBB.","Bayo Onanuga, a media aide to president-elect, Bola Tinubu, has accused Peter Obi, presidential candidate of the Labour Party, LP, of trying to treat his principal like retired military dictator, Ibrahim Badamosi Babangida (IBB) did to MKO Abiola, whose presidential election victory got annulled 30 years ago.Onanuga claimed that Obi's move to challenge the 2023 presidential election results is similar to how the 1993 election of MKO Abiola was invalidated by IBB.He tweeted on Tuesday evening: ""P",no
71,"Astronomers warn that increasing light pollution from satellite mega-constellations, especially by SpaceX, threatens astronomical observations and cultural connections to the night sky.",What international treaties and goals can be set to restrict levels of light pollution?,Governments around the world should and can tackle light pollution in the same ways they address climate change: with international treaties and goals to restrict levels of other pollutants.,"The authors urged astronomers, companies, politicians, and lawmakers around the world to work together to reach a global agreement to limit artificial light. Light pollution should be treated in the same way that other types of pollutants, like greenhouse gases, they argued. Governments around the world should and can tackle light pollution in the same ways they address climate change: with international treaties and goals to restrict levels of other pollutants.Another issue astronomers face is ",no
72,"Damning report by Baroness Louise Casey reveals the Metropolitan Police's ""institutional racism, misogyny, and homophobia,"" calling for urgent reforms or potential disbandment.",What did the independent review into the Metropolitan Police Service conclude?,"The independent review into the Metropolitan Police Service concluded that it is institutionally racist, sexist and homophobic, has lost the trust and confidence of the people it is supposed to keep safe, and that policing by consent in the capital is ""broken"".","London's police force has lost the confidence of the people it serves because it is riven with institutional racism, misogyny and homophobia and doesn't do enough to weed out bad officers, according to a withering report commissioned after a young woma...LONDON -- London's police force has lost the confidence of the people it serves because it is riven with institutional racism, misogyny and homophobia and doesn't do enough to weed out bad officers, according to a withering report commissioned a",yes
73,Russia escalates missile and drone strikes on Ukraine as diplomatic efforts for peace falter amid visits from leaders like Xi Jinping and Kishida.,What could be the consequences of the drone and missile attacks on the lives of people?,Russian aggression towards Ukraine has caused widespread damage and threatens the lives of ordinary citizens.,"Rescuers work at the site of a building heavily damaged by Russian drone strikes in the town of Rzhyshchiv, in Kyiv region, Ukraine.Alina Yarysh/ReutersRussia blasted an apartment block in Ukraine with missiles on Wednesday after launching a swarm of drones at cities overnight, a deadly display of force following a solidarity visit by China's leader Xi Jinping.Ukraine's President Volodymyr Zelensky tweeted security camera video of a residential apartment block in the southern city of Zaporizhzhi",no
74,North Koreans resent Kim Jong Un's daughter Kim Ju Ae for her lavish lifestyle amid the country's severe food shortages.,How does the regime's propaganda align with the actual living conditions of North Korean citizens?,"The appearance of Kim Jong Un's daughter with her father, who is testing intercontinental ballistic missiles, is arousing anger among North Koreans who cannot even eat properly.","""For all we know this is just [Kim] doting on a favourite child, but the more that she shows up, the more it seems that she's either being fully groomed for leadership or at least floated as a possibility,"" Mason Richey, a professor at Hankuk University of Foreign Studies in Seoul, told Reuters.The girl has not been named in state media since she was first shown attending a missile launch with her dad last year, but South Korean intelligence officials believe she is the daughter identified as Ju",no
75,"Somalia Faces Severe Drought Crisis with 43,000 Estimated Deaths in 2022, Warns WHO and UNICEF.",How can Somalia build resilience against future droughts and climate change?,"The UN report commissioned by the London School of Hygiene and Tropical Medicine and Imperial College London suggests that Somalia can build resilience against future droughts and climate change by sustaining and scaling up ""health and nutrition actions and humanitarian response to save lives and protect the health of our vulnerable"".","""We continue to be concerned about the level and scale of the public health impact of this deepening and protracted food crisis in Somalia,"" said Somalia's Health Minister, Dr Ali Hadji Adam Abubakar.""At the same time, we are optimistic that if we can sustain our ongoing and scaled-up health and nutrition actions and humanitarian response to save lives and protect the health of our vulnerable, we can push back the risk of famine forever, else those vulnerable and marginalized will pay the price ",no
76,"Israel's Knesset Repeals Disengagement Law, Allowing Settlers Back into Northern West Bank Amid U.S. and International Criticism.","What other measures has Israel taken to ease tensions ahead of the sensitive period that includes the Muslim holy month of Ramadan and the Jewish festival of Passover, and will they be successful in reducing violence?",Israel has taken measures to ease tensions ahead of the sensitive period that includes the Muslim holy month of Ramadan and the Jewish festival of Passover by providing security forces with extra reinforcement to close off flashpoint areas and to streamline intelligence sharing with Palestinian security forces.,"The repealing of the disengagement law in the northern West Bank was met with fierce criticism from the international community, including from Israel's closest ally, the United States.On Tuesday Israel's ambassador to the US was summoned to the State Department for an unscheduled meeting in a rare move by the Biden administration aimed at escalating its protest against the Knesset's passage of the law, a US official told The Times of Israel.A readout issued by the US after Ambassador Mike Herzo",no
77,"U.S. State Department's 2022 Human Rights Report highlights significant abuses in India, Pakistan, Israel, and China under Secretary Antony Blinken.","What challenges and opportunities lie ahead for advancing human rights efforts worldwide, and how can the US respond to these developments?","The US can respond to these developments by providing guidance to US diplomatic missions annually for submission of updated reports on human rights practices, which can be comprehensive, objective, and uniform in scope.","Persons with Disabilities: Covers discrimination against persons with physical, mental, or intellectual disabilities in, among other things, access to public buildings, employment, education, housing, health care, and the provision of other government services.",yes
78,Ukraine prepares for a critical spring counteroffensive against Russia as heavy fighting in Bakhmut drains resources and troops.,Can lack of weapons and manpower affect Ukraine's chances for victory?,"Yes, lack of manpower could affect Ukraine's chances for victory because ""the first option is unrealistic, officials say, because Ukraine lacks the manpower to mount this kind of successful amphibious operation.""","Ukraine has lost many of its junior officers who received U.S. training over the past nine years, the Ukrainian official said. Now, the official said, those forces must be replaced - ""a lot of them are killed.""US Defense Secretary Lloyd Austin remains laser-focused on ensuring that Ukraine is receiving the training it needs for the current fight. The United States is ""working around-the-clock"" to fulfill Ukraine's security needs, in addition to investing billions of dollars to produce and procur",no
79,"Saudi Arabia and Iran agree to restore diplomatic ties in a China-brokered deal, signaling a shift in Middle Eastern geopolitics.",How might the deal brokered by China and the United States impact U.S.-China competition in the Middle East?,Officials are pushing back against the notion that the developments amount to a shift in the dynamics of the U.S.-China competition in the Middle East.,"But privately White House officials are skeptical about China's ability, and desire, to play a role in resolving some of the region's most difficult crises, including the long, disastrous proxy war in Yemen.ADVERTISEMENTIran-allied Houthis seized Yemen's capital, Sanaa, in 2014 and forced the internationally recognized government into exile in Saudi Arabia. A Saudi-led coalition armed with U.S. weaponry and intelligence entered the war on the side of Yemen's exiled government in 2015.Years of in",yes
80,"Thailand's Prime Minister Prayuth Chan-o-cha dissolves parliament, paving the way for a May election amid a power struggle against the opposition Pheu Thai party led by Paetongtarn Shinawatra.",What will be the main issues affecting voters in the upcoming election?,"Other issues that may affect voters include the desire for a new constitution and a reduction in the power of the monarchy, and the challenge of voting for a political party with no ideological differences.","He also faced strong opposition from the Pheu Thai party which seeks to end a decade of military rule. The party is represented by Paetongtarn Shinawatra, daughter of former prime minister Thaksin Shinawatra who was overthrown in a coup in 2006. Over the last two decades, Thaksin-affiliated parties have won the most seats in every Thai election.A poll conducted last December found that the Pheu Thai party received 49.75 per cent support among 2,000 people surveyed.Winning election might come dow",no
81,"Israel's Knesset Repeals Disengagement Law, Allowing Settlers Back into Northern West Bank Amid U.S. and International Criticism.","What is the role of the current Israeli government in promoting settlement expansion, and how does it compare to previous administrations?","""Israel sought on Wednesday to calm international concern over its amending of a law that had ordered the 2005 evacuation of settlers from an area of the occupied West Bank, saying it had no intention of building new settlements there.""","Israeli Prime Minister Benjamin Netanyahu hailed on Wednesday the Knesset's partial repeal of the ""discriminatory and humiliating"" 2005 Disengagement Law that expelled Jews from their ""historical homeland.""The Israeli parliament on Tuesday voted to repeal articles of the law banning Israelis from entering and residing in parts of northern Samaria. The disengagement also led to the destruction and evacuation of 21 communities in the Gaza Strip.""The Knesset decision to repeal parts of the Disengag",yes
